{
  "schema_version": "1.0.0",
  "machine_id": "komatsu-pc210lc-11",
  "display_name": "Komatsu PC210LC-11",
  "configuration_id": "KOMATSU-PC210LC11-CONV-T4F-57B-2925A-700SH-TL085-CANDIDATE",
  "archetype": "excavator",
  "dimensions_m": {"length":9.705,"width":3.08,"height":3.135},
  "palette": "sand",
  "published_constraints_used": ["public-envelope-x","public-envelope-y","public-envelope-z","boom-length","arm-length","shoe-width","track-length","track-gauge","selected-bucket-capacity","selected-bucket-width"],
  "reconstructed_values": {
    "hidden_geometry":"All front-equipment pivots and hydraulic anchors, bucket four-bar geometry, swing bearing, undercarriage rollers and belt route, hose paths, motion curves and internal construction are reconstructed visualization choices.",
    "visible_actuation_study":"The fixed boom-lift cylinder, arm-crowd barrel and overlapping rod, bucket-curl barrel and overlapping rod, H-link, paired dogbones, pins, clevis and bucket ears are independently reconstructed for static visual closure. They are not manufacturer anchor coordinates or a solved linkage."
  },
  "unresolved_choices": ["exact regional serial and equipment revision","coupler and tooth package","guards, cameras, lighting and hydraulics"],
  "mechanical_gaps": ["No manufacturer-authoritative front-equipment solver","No collision or swept-volume proof"]
}
